id	btype	title	author	year	journal	volume	number	pages	booktitle	publisher	school	doi	url
DBLP:journals/pvldb/AbebeLD22	article	Tiresias: Enabling Predictive Autonomous Storage and Indexing	Michael Abebe and Horatiu Lazu and Khuzaima Daudjee	2022	Proceedings of the VLDB Endowment (PVLDB)	15	11	3126--3136					https://www.vldb.org/pvldb/vol15/p3126-abebe.pdf
DBLP:journals/pvldb/DadvarGS22	article	POEM: Pattern-Oriented Explanations of CNN Models	Vargha Dadvar and Lukasz Golab and Divesh Srivastava	2022	Proceedings of the VLDB Endowment (PVLDB)	15	12	3618--3621					https://www.vldb.org/pvldb/vol15/p3618-golab.pdf
DBLP:conf/wadl/WangLML17	inproceedings	Topic Shifts Between Two US Presidential Administrations	Ziquan Wang and Borui Lin and Ian Milligan and Jimmy Lin	2017					Web Archiving and Digital Libraries Workshop (WADL)				https://vtechworks.lib.vt.edu/bitstream/handle/10919/97989/WADL2017.pdf#page=13
DBLP:journals/pvldb/AmmarSSO22	article	Optimizing Differentially-Maintained Recursive Queries on Dynamic Graphs	Khaled Ammar and Siddhartha Sahu and Semih Salihoglu and Tamer Özsu	2022	Proceedings of the VLDB Endowment (PVLDB)	15	11	3186--3198					https://www.vldb.org/pvldb/vol15/p3186-ammar.pdf
DBLP:journals/toit/XiaZJO22	article	Introduction to the Special Section on Edge/Fog Computing for Infectious Disease Intelligence	Kaijian Xia and Wenbing Zhao and Alireza Jolfaei and Tamer Özsu	2022	ACM Transactions on Internet Technology (TOIT)	22	3	63e:1--63e:2				10.1145/3494119	https://doi.org/10.1145/3494119
DBLP:journals/pvldb/MhedhbiS22	article	Modern Techniques for Querying Graph-Structured Relations: Foundations, System Implementations, and Open Challenges	Amine Mhedhbi and Semih Salihoglu	2022	Proceedings of the VLDB Endowment (PVLDB)	15	12	3762--3765					https://www.vldb.org/pvldb/vol15/p3762-mhedhbi.pdf
